{
  "schema_version": "0.6",
  "review_id": "review-aws-iam-004-r4",
  "episode_id": "aws-iam-004",
  "reviewer_id": "anibal.canada",
  "reviewed_at": "2026-08-09T14:45:42Z",
  "status": "approved",
  "public_package_sha256": "c3ed3b7542eb085004c54cd12d168704046f3dd2d808c4e085eec0a9caf52ce2",
  "private_ground_truth_sha256": "9e71b3e47b055b2276a00bcf1511cb14de275d23273a32a328d6b5cc1dbaccb5",
  "reference_query_sha256": "48a409250d9b1d2767bc544db021da150f2ed8a10becc082d1e12ef1f5dcc2e9",
  "review_policy_sha256": "d7b32ea129bf68b65fa612c906eb17cd3b6d97d48869a8561eec96af5bc60a0f",
  "reason_codes": []
}
