{"schema_version":"0.6","review_id":"review-aws-iam-001","episode_id":"aws-iam-001","reviewer_id":"reviewer-001","reviewed_at":"2026-08-09T00:00:00Z","status":"approved","public_package_sha256":"1111111111111111111111111111111111111111111111111111111111111111","private_ground_truth_sha256":"2222222222222222222222222222222222222222222222222222222222222222","reference_query_sha256":"3333333333333333333333333333333333333333333333333333333333333333","review_policy_sha256":"4444444444444444444444444444444444444444444444444444444444444444","reason_codes":[]}
