{
  "schema_version": "0.6",
  "review_id": "review-azure-iam-004-r4",
  "episode_id": "azure-iam-004",
  "reviewer_id": "anibal.canada",
  "reviewed_at": "2026-08-09T14:45:42Z",
  "status": "approved",
  "public_package_sha256": "ba1b924ab8c919a7e85049b02a7ce8a868f9745c1d8b770b6d206c3dc0671742",
  "private_ground_truth_sha256": "52ed72b49e3523393e219d4d40f1783647c60904f726d5fb814314780216c70f",
  "reference_query_sha256": "e4a02c7b7164238ede1976b34994b64d5ec3c030def89473a9ea59ea8fce4c47",
  "review_policy_sha256": "d7b32ea129bf68b65fa612c906eb17cd3b6d97d48869a8561eec96af5bc60a0f",
  "reason_codes": []
}
